{
  "$schema": "../.source/json-schema/docs.meta.json",
  "title": "Getting Started",
  "description": "Set up and start using data.gv.at MCP Server",
  "icon": "Rocket",
  "root": true,
  "defaultOpen": true,
  "pages": [
    "index",
    "---[Zap]Quick Start---",
    "quickstart",
    "installation",
    "first-query",
    "---[HelpCircle]Support---",
    "quick-reference",
    "troubleshooting"
  ]
}
