{
  "$schema": "../../../../.source/json-schema/docs.meta.json",
  "title": "Advanced Topics",
  "description": "Deep dive into data.gv.at MCP Server internals",
  "icon": "Settings",
  "pages": [
    "architecture",
    "fastmcp-internals",
    "middleware",
    "semantic-search",
    "error-handling",
    "testing"
  ]
}
