{
  "$schema": "../../../../.source/json-schema/docs.meta.json",
  "title": "Getting Started",
  "description": "Set up and start using data.gv.at MCP Server",
  "icon": "Rocket",
  "defaultOpen": false,
  "pages": [
    "index",
    "quickstart",
    "installation",
    "first-query",
    "quick-reference",
    "troubleshooting",
    "tutorial"
  ]
}