{
  "$schema": "../../../.source/json-schema/docs.meta.json",
  "title": "Documentation",
  "description": "Complete guides, workflows, and examples",
  "icon": "BookOpen",
  "root": true,
  "defaultOpen": true,
  "pages": [
    "---Introduction---",
    "index",
    "getting-started",
    "---Guides---",
    "guides",
    "workflows",
    "examples",
    "---Advanced---",
    "integration",
    "best-practices",
    "advanced"
  ]
}