{
  "$schema": "..\\..\\..\\.source\\json-schema\\docs.meta.json",
  "title": "Fumadocs MDX",
  "description": "The official content source",
  "icon": "Pencil",
  "root": true,
  "pages": [
    "---Guide---",
    "index",
    "performance",
    "page",
    "entry",
    "---Integrations---",
    "...(integrations)",
    "---Configuration---",
    "collections",
    "global",
    "mdx",
    "plugin",
    "---Features---",
    "include",
    "last-modified",
    "manifest",
    "async",
    "..."
  ]
}