{
  "$schema": "../../../../.source/json-schema/docs.meta.json",
  "title": "Best Practices",
  "description": "Performance optimization, quality metrics interpretation, tool selection guidance, and production deployment best practices",
  "icon": "Lightbulb",
  "pages": [
    "optimization",
    "quality-interpretation",
    "comparison-tables",
    "rate-limiting",
    "caching-strategies"
  ]
}
