{
  "$schema": "../../../../.source/json-schema/docs.meta.json",
  "title": "Workflows",
  "description": "Complete end-to-end workflows",
  "icon": "Workflow",
  "pages": [
    "discovery",
    "semantic-exploration",
    "quality-assessment",
    "comparative-analysis",
    "publication-research",
    "data-export"
  ]
}