{
  "$schema": "..\\..\\..\\.source\\json-schema\\docs.meta.json",
  "title": "Fumadocs UI",
  "description": "The default theme",
  "icon": "PanelsTopLeft",
  "root": true,
  "pages": [
    "---Introduction---",
    "index",
    "component-library",
    "theme",
    "---References---",
    "..."
  ]
}