{
  "$schema": "../.source/json-schema/docs.meta.json",
  "title": "Workflows",
  "description": "Complete end-to-end workflows for common data tasks",
  "icon": "Workflow",
  "root": true,
  "pages": [
    "discovery",
    "quality-assessment",
    "data-export",
    "comparative-analysis",
    "publication-research",
    "semantic-exploration"
  ]
}
