{
  "$schema": "..\\..\\..\\.source\\json-schema\\docs.meta.json",
  "title": "Framework",
  "description": "The docs framework",
  "icon": "Building",
  "root": true,
  "pages": [
    "---Introduction---",
    "index",
    "what-is-fumadocs",
    "comparisons",
    "manual-installation",
    "guides",
    "---Writing---",
    "page-conventions",
    "markdown",
    "---Configurations---",
    "navigation",
    "versioning",
    "deploying",
    "internationalization",
    "search",
    "---Integrations---",
    "...integrations"
  ]
}