{
  "$schema": "..\\..\\..\\.source\\json-schema\\docs.meta.json",
  "title": "Advanced Topics",
  "description": "Deep dive into Austria MCP internals",
  "icon": "Settings",
  "root": true,
  "pages": [
    "architecture",
    "fastmcp-internals",
    "middleware",
    "semantic-search",
    "error-handling",
    "testing"
  ]
}